TITLE,AUTHOR,VERSION,PRICE
Algo que sirva como luz,Fernando Navarro Cano,tapa blanda,"18,90"
Tu cerebro tiene hambre,Boticaria Garcia,tapa blanda,"18,90"
Deja de ser tu. la mente crea la realidad,Joe Dispenza,otros,"17,10"
Carne gobernada,Fernando Savater,tapa blanda,"19,85"
Habitos atomicos,James Clear,tapa blanda,"18,90"
Cómo hacer que te pasen cosas buenas,Marian Rojas,tapa blanda,"18,90"
La llamada,Leila Guerriero,tapa blanda,"19,85"
Educa tu cerebro,David Bueno,tapa blanda,"19,85"
El hombre en busca de sentido,Viktor E. Frankl,tapa blanda,"12,25"
Por si las voces vuelven,Angel Martin,tapa blanda,"7,55"
